product,review
Laptop,The laptop is fast and reliable.
Smartphone,The smartphone has a long battery life but the camera quality could be better.
Headphones,These headphones provide excellent sound quality and are comfortable to wear.
Coffee Maker,The coffee maker brews coffee quickly but the carafe is prone to spills.
Fitness Tracker,The fitness tracker accurately tracks steps and sleep patterns.
Television,The television has a great picture quality but the sound could be improved.
Vacuum Cleaner,The vacuum cleaner has powerful suction and is easy to maneuver.
Toaster,The toaster evenly toasts bread slices and has a sleek design.